{
  "profile": "boxui/0.1",
  "documentId": "activity-demo",
  "bindings": [
    {
      "id": "measurement",
      "role": "value",
      "type": "number"
    },
    {
      "id": "context",
      "role": "value",
      "type": "string"
    },
    {
      "id": "set-context",
      "role": "command",
      "type": "string"
    },
    {
      "id": "suspend",
      "role": "command",
      "type": "none"
    },
    {
      "id": "resume",
      "role": "command",
      "type": "none"
    }
  ],
  "root": {
    "id": "panel",
    "kind": "column",
    "version": 1,
    "children": [
      {
        "id": "heading",
        "kind": "text",
        "version": 1,
        "text": "Simulert Activity — ikke produksjonsstyring"
      },
      {
        "id": "measure",
        "kind": "value",
        "version": 1,
        "label": "Måling (mm)",
        "valueBinding": "measurement"
      },
      {
        "id": "context-input",
        "kind": "input",
        "version": 1,
        "label": "Arbeidskontekst",
        "valueBinding": "context",
        "commandBinding": "set-context"
      },
      {
        "id": "actions",
        "kind": "row",
        "version": 1,
        "children": [
          {
            "id": "pause",
            "kind": "button",
            "version": 1,
            "label": "Suspend",
            "commandBinding": "suspend"
          },
          {
            "id": "continue",
            "kind": "button",
            "version": 1,
            "label": "Resume",
            "commandBinding": "resume"
          }
        ]
      },
      {
        "id": "state-view",
        "kind": "diagram",
        "version": 1,
        "label": "Dokumentert livsløp, ikke kjørbar tilstandsmaskin",
        "family": "stateDiagram-v2",
        "source": "stateDiagram-v2\n[*] --> Running\nRunning --> Suspended: Suspend\nSuspended --> Running: Resume accepted",
        "size": {
          "min": 160,
          "grow": 1
        }
      }
    ]
  }
}
